{
  "meta": {
    "source": "https://www.gov.cn/zhengce/zhengceku/example-notice.html",
    "publisher": "某部委",
    "publish_date": "2026-09-15",
    "effective_date": "2027-01-01",
    "doc_type": "policy",
    "doc_number": "某规〔2026〕7号",
    "source_grade": "high",
    "material_nature": "problem_oriented"
  },

  "signals": [
    {
      "quote": "鼓励中小企业加快数字化改造，提升生产经营效率",
      "verb": "鼓励",
      "strength": "L1-suggest",
      "target": "中小企业"
    },
    {
      "quote": "规模以上企业应当于 2027 年底前完成数据台账建设",
      "verb": "应当",
      "strength": "L3-require",
      "target": "规模以上企业"
    },
    {
      "quote": "严禁以数字化改造名义变相收集员工个人信息",
      "verb": "严禁",
      "strength": "L4-mandate",
      "target": "全部实施主体"
    }
  ],

  "gap": {
    "type": "capability_gap",
    "reasoning": "文件对中小企业用『鼓励』（L1，无强制），对规模以上企业用『应当』（L3，强约束）并给出明确截止日，说明政策真实抓手在规模以上企业。而『鼓励中小企业数字化』这一表述本身证明：中小企业当前数字化能力不足是既存事实，否则无需倡导。同时文件专设『严禁变相收集个人信息』条款，反向说明市场上已存在以数字化为名的数据滥用行为——即信任缺口与能力缺口并存。主要缺口为能力缺口（不会做），次要缺口为信任缺口（不敢用）。",
    "temporality": "structural",
    "who_bears_cost": "中小企业的改造成本由企业自身承担，文件未提及任何补贴或分担机制"
  },

  "position": {
    "role": "cost_bearer",
    "direct_impact": "若你所在企业年营收达到规模以上标准，2027 年底前必须完成数据台账建设，这意味着需要新增至少 1 名兼职数据管理人力或采购一套台账工具，年度成本约 2-8 万元。若为中小企业，则不构成强制义务，但上下游大企业可能将台账要求沿供应链传导，形成事实上的准入条件。",
    "exit_cost": "已投入的台账系统与人力在政策存续期内无法回收；若后续标准提高，需二次改造",
    "barriers": [
      {
        "kind": "qualification",
        "passed": true,
        "note": "数据台账建设无需前置许可证，属企业内部管理事项"
      },
      {
        "kind": "capability",
        "passed": false,
        "note": "团队无数据治理经验，需外部支持或招聘，短期内难以自建"
      },
      {
        "kind": "scale",
        "passed": true,
        "note": "最小可行方案为 1 人 + 1 套工具，2 人团队可承接"
      }
    ]
  },

  "matrix": {
    "direct_opportunity": {
      "content": "为规模以上企业提供数据台账搭建的轻量工具或代建服务，切入点是政策已明确强制、截止日已定、企业无自建能力",
      "evidence": "原文『应当于 2027 年底前完成』给出确定的时间窗口与义务主体；『鼓励中小企业』说明能力缺口普遍存在，规模以上企业同样缺乏内部能力",
      "barrier": "需具备数据治理基础认知；需在 2027 年前建立可复用的模板与交付流程"
    },
    "hidden_opportunity": {
      "content": "供应链传导带来的中小企业被动合规需求——大企业为满足自身台账完整性，会要求供应商提供数据说明",
      "evidence": "文件未直接约束中小企业，但『提升生产经营效率』与台账要求并存，实务中大企业通常将合规成本向供应链转移",
      "barrier": "该需求尚未显现，需验证：先接触 3 家规模以上企业的采购或合规部门，确认是否已向供应商提出数据要求"
    },
    "explicit_risk": {
      "content": "若以『数字化改造』名义采集员工个人信息，直接触碰 L4 禁止条款，可能面临行政处罚与民事索赔",
      "evidence": "原文『严禁以数字化改造名义变相收集员工个人信息』为强制性条款，违反有明确罚则",
      "barrier": "需在方案设计阶段做数据最小化审查，采集范围限定于经营数据，排除个人维度"
    },
    "implicit_risk": {
      "content": "政策执行尺度存在地区差异，部分地方可能加码要求，导致已交付方案不满足后续标准",
      "evidence": "文件为部委层面指导意见，未给出统一的技术标准细则，地方实施细则可能更严",
      "barrier": "需持续跟踪地方实施细则；方案设计须预留字段扩展能力"
    }
  },

  "actions": {
    "immediate": [
      {
        "what": "确认所在企业是否达到规模以上标准，若达到则立即启动台账现状盘点",
        "when": "本周内",
        "verifiable": "产出一页纸现状清单，列明现有数据来源、存储位置、责任人",
        "budget_cap": "0 元（内部人力）",
        "abandon_if": null
      },
      {
        "what": "检索本省/本市是否有配套实施细则，确认是否存在加码要求",
        "when": "本周内",
        "verifiable": "在省级工信或数据主管部门官网找到对应文件或确认无，截图存档",
        "budget_cap": "0 元",
        "abandon_if": null
      }
    ],
    "quarter": [
      {
        "what": "试做一版台账模板，在单个业务线跑通，验证可用性",
        "when": "3 个月内",
        "verifiable": "模板文件 + 1 条业务线的完整台账数据，可供内部复核",
        "budget_cap": "不超过 2 万元（工具采购 + 外部咨询）",
        "abandon_if": "若 30 天内无法在任一业务线跑通，说明内部数据基础不具备，转为纯人工台账"
      }
    ],
    "annual": [
      {
        "what": "完成全公司数据台账建设并通过内部审计",
        "when": "2027 年底前",
        "verifiable": "台账系统上线 + 内部审计报告 + 覆盖全部业务线",
        "budget_cap": "按季度预算审批",
        "abandon_if": null
      }
    ],
    "stop_loss": [
      {
        "metric": "外部咨询与工具投入累计金额",
        "threshold": "超过 8 万元仍未跑通单条业务线",
        "action": "stop"
      },
      {
        "metric": "地方实施细则的严格程度",
        "threshold": "地方要求超出部委文件范围且需重构方案",
        "action": "pivot"
      }
    ],
    "watch_window": [
      "省级配套实施细则是否出台及加码程度",
      "同行企业是否已被要求提供供应链数据说明",
      "是否有官方推荐的技术标准或白名单工具"
    ]
  },

  "confidence": {
    "level": "medium",
    "weakest_link": "缺口类型判定为『能力不足』主要依据是『鼓励』措辞的反向推理，而非文件明示。若实际政策意图是推动行业集中度提升（即鼓励兼并而非补能力短板），则本分析的机会方向判断错误。",
    "falsifier": "若后续出台配套补贴政策或官方免费工具，说明政策意图是降低门槛而非创造服务市场，则第三方服务机会消失。",
    "missing_info": [
      "本省是否已有配套实施细则",
      "规模以上企业的具体认定标准与本地执行口径",
      "是否有官方推荐或认证的技术方案"
    ]
  }
}
