{
  "meta": {
    "source": "https://open.example-platform.cn/docs/rule-update-2026q4",
    "publisher": "某内容平台",
    "publish_date": "2026-10-20",
    "effective_date": "2026-12-01",
    "doc_type": "platform_rule",
    "doc_number": null,
    "source_grade": "high",
    "material_nature": "problem_oriented"
  },

  "signals": [
    {
      "quote": "平台鼓励创作者持续输出原创、有信息增量的内容",
      "verb": "鼓励",
      "strength": "L1-suggest",
      "target": "内容创作者"
    },
    {
      "quote": "自 2026 年 12 月 1 日起，账号应当完成创作者身份信息核验，未完成核验的账号将限制提现",
      "verb": "应当",
      "strength": "L3-require",
      "target": "有收益的创作者账号"
    },
    {
      "quote": "严禁通过批量注册、内容搬运、机器生成等方式套取流量分成",
      "verb": "严禁",
      "strength": "L4-mandate",
      "target": "全部创作者"
    }
  ],

  "gap": {
    "type": "trust_deficit",
    "reasoning": "规则同时做了三件事：鼓励原创（L1）、要求身份核验并绑定提现（L3）、严禁搬运与机器生成（L4）。核验要求与提现绑定，说明平台此前的分发收益存在被非真实主体套取的情况——否则无需在提现阶段设卡。『鼓励原创』这一措辞本身证明原创供给不足。而把『机器生成』与『批量注册』『搬运』并列列入禁止项，反向说明这三类行为已形成规模化套利，平台的反作弊识别能力此前不足以覆盖。主要缺口为信任缺失（无法区分真实创作者与套利者），次要缺口为供给不足（原创内容不够）。",
    "temporality": "structural",
    "who_bears_cost": "身份核验的时间成本与隐私让渡由创作者承担，规则未提供替代方案"
  },

  "position": {
    "role": "cost_bearer",
    "direct_impact": "若你的账号有收益，12 月 1 日前必须完成身份核验，否则提现被限制——这是硬性收入中断风险，不是体验问题。若你的内容生产流程中含 AI 生成环节，需重新评估是否触碰『机器生成套取流量分成』的边界，因为该条款未给出量化标准（例如 AI 辅助比例上限），存在解释空间。",
    "exit_cost": "已积累的粉丝与内容资产无法迁移到其他平台，账号价值与平台绑定",
    "barriers": [
      {
        "kind": "qualification",
        "passed": true,
        "note": "身份核验为个人实名，无额外资质要求"
      },
      {
        "kind": "capability",
        "passed": true,
        "note": "核验流程为平台内操作，无需外部能力"
      },
      {
        "kind": "scale",
        "passed": false,
        "note": "若要转向原创内容，需持续产出能力，单人难以稳定支撑高频更新"
      }
    ]
  },

  "matrix": {
    "direct_opportunity": {
      "content": "为中小创作者提供身份核验代办与合规自查服务，切入点是核验有明确截止日、失败会导致提现中断、且平台未提供辅助指引",
      "evidence": "原文『未完成核验的账号将限制提现』给出明确的失效后果与时间点；规则全文未提及核验失败的处理流程或客服通道",
      "barrier": "需准确掌握核验材料要求；需在 12 月 1 日前建立可批量处理的服务流程"
    },
    "hidden_opportunity": {
      "content": "AI 生成内容的合规边界咨询——规则禁止『机器生成套取流量分成』但未量化，创作者需要判断自己的生产流程是否越线",
      "evidence": "禁止项把『机器生成』与『批量注册』『搬运』并列，指向的是套利行为而非工具使用；但文本未给出比例或场景标准",
      "barrier": "该边界解释权在平台，咨询服务存在给出错误判断的风险，需明确免责边界"
    },
    "explicit_risk": {
      "content": "若继续使用批量账号或搬运内容，将直接触发 L4 禁止条款，后果包括封号与收益追回",
      "evidence": "原文『严禁通过批量注册、内容搬运、机器生成等方式套取流量分成』为强制性条款",
      "barrier": "需立即停止多账号矩阵运营，改为单账号深耕"
    },
    "implicit_risk": {
      "content": "核验信息与账号绑定后，账号转让与代运营的可行性下降，原有账号交易市场可能萎缩",
      "evidence": "身份核验要求实名且绑定提现，使账号与真实主体一一对应，规则未提及解绑机制",
      "barrier": "需评估现有账号是否依赖代运营；若依赖，需在 12 月 1 日前完成主体变更"
    }
  },

  "actions": {
    "immediate": [
      {
        "what": "登录后台确认账号是否需要身份核验，并完整走一遍核验流程",
        "when": "本周内",
        "verifiable": "后台显示核验状态为「已通过」，截图存档",
        "budget_cap": "0 元",
        "abandon_if": null
      },
      {
        "what": "审查现有内容生产流程，标记所有含 AI 生成的环节及占比",
        "when": "本周内",
        "verifiable": "产出一份环节清单，逐项标注 AI 参与方式（起草/改写/配图/标题）",
        "budget_cap": "0 元",
        "abandon_if": null
      }
    ],
    "quarter": [
      {
        "what": "把 AI 参与环节从「成稿生成」收缩到「素材整理与结构建议」，保留人工写作主体",
        "when": "3 个月内",
        "verifiable": "连续 30 天的发布记录中，AI 仅用于选题与提纲环节，正文为人工撰写",
        "budget_cap": "不超过 3000 元（工具订阅）",
        "abandon_if": "若 30 天内流量下降超过 50% 且无回升，说明当前内容形态高度依赖 AI 生成，需重新评估赛道"
      }
    ],
    "annual": [
      {
        "what": "建立稳定的原创选题与采访信息源，降低对热点搬运的依赖",
        "when": "12 个月内",
        "verifiable": "形成 10 个以上可持续跟踪的信息源清单，且 3 个月内至少产出 5 篇一手采访内容",
        "budget_cap": "按季度评估",
        "abandon_if": null
      }
    ],
    "stop_loss": [
      {
        "metric": "身份核验状态",
        "threshold": "11 月 20 日前仍未通过核验",
        "action": "pivot"
      },
      {
        "metric": "单账号月收益",
        "threshold": "转型原创后连续 2 个月低于转型前的 40%",
        "action": "stop"
      }
    ],
    "watch_window": [
      "平台是否出台 AI 生成内容的具体量化标准",
      "核验失败的申诉通道是否开放",
      "同类平台是否跟进身份核验要求"
    ]
  },

  "confidence": {
    "level": "high",
    "weakest_link": "对『机器生成套取流量分成』的解释依赖文本推断——我判断该条款针对的是套利行为而非 AI 工具本身，但平台实际执行可能对任何 AI 参与都从严认定。这一点无法从规则原文确定。",
    "falsifier": "若平台发布补充说明，明确 AI 辅助写作（如润色、提纲）不受限制，则本分析中关于生产流程调整的必要性判断偏保守；反之若平台开始批量处罚 AI 辅助账号，则需立即停止一切 AI 参与。",
    "missing_info": [
      "核验失败的具体原因分类与申诉路径",
      "平台对 AI 生成内容的检测手段与判定阈值",
      "是否有过渡期内的宽限处理"
    ]
  }
}
